URL,Version,Status,OIDs,Name,Title,Descriptino,Used
http://unitsofmeasure.org,3.0.1,active,"2.16.840.1.113883.6.8",UCUM,Unified Code for Units of Measure (UCUM),"The Unified Code for Units of Measure (UCUM) is a code system intended to include all units of measures being contemporarily used in international science, engineering, and business. The purpose is to facilitate unambiguous electronic communication of quantities together with their units. The focus is on electronic communication, as opposed to communication between humans. A typical application of The Unified Code for Units of Measure are electronic data interchange (EDI) protocols, but there is nothing that prevents it from being used in other types of machine communication.","ValueSet/ValueSet-units-of-gestational-age,ValueSet/ucum-vitals-common,ValueSet/ucum-bodylength"
http://www.ada.org/cdt,3.0.1,active,"2.16.840.1.113883.6.13",CDT,Code on Dental Procedures and Nomenclature,"The purpose of the CDT Code is to achieve uniformity, consistency and specificity in accurately documenting dental treatment. One use of the CDT Code is to provide for the efficient processing of dental claims, and another is to populate an Electronic Health Record.","ValueSet/us-core-procedure-code"
http://www.ama-assn.org/go/cpt,3.0.1,active,"2.16.840.1.113883.6.12",CPT,Current Procedural Terminology (CPT®),"The Current Procedural Terminology (CPT) code set, created and maintained by the American Medical Association, is the language of medicine today and the code to its future. This system of terminology is the most widely accepted medical nomenclature used to report medical procedures and services under public and private health insurance programs. CPT coding is also used for administrative management purposes such as claims processing and developing guidelines for medical care review. Each year, via a rigorous, evidence-based and transparent process, the independent CPT Editorial Panel revises, creates or deletes hundreds of codes in order to reflect current medical practice.    Designated by the U.S. Department of Health and Human Services under the Health Insurance Portability and Accountability Act (HIPAA) as a national coding set for physician and other health care professional services and procedures, CPT’s evidence-based codes accurately encompass the full range of health care services.    All CPT codes are five-digits and can be either numeric or alphanumeric, depending on the category. CPT code descriptors are clinically focused and utilize common standards so that a diverse set of users can have common understanding across the clinical health care paradigm.    There are various types of CPT codes:    Category I: These codes have descriptors that correspond to a procedure or service. Codes range from 00100–99499 and are generally ordered into sub-categories based on procedure/service type and anatomy.    Category II: These alphanumeric tracking codes are supplemental codes used for performance measurement. Using them is optional and not required for correct coding.    Category III: These are temporary alphanumeric codes for new and developing technology, procedures and services. They were created for data collection, assessment and in some instances, payment of new services and procedures that currently don’t meet the criteria for a Category I code.    Proprietary Laboratory Analyses (PLA) codes: These codes describe proprietary clinical laboratory analyses and can be either provided by a single (“solesource”) laboratory or licensed or marketed to multiple providing laboratories that are cleared or approved by the Food and Drug Administration (FDA)). This category includes but is not limited to Advanced Diagnostic Laboratory Tests (ADLTs) and Clinical Diagnostic Laboratory Tests (CDLTs), as defined under the Protecting Access to Medicare Act of 2014 (PAMA).","ValueSet/us-core-encounter-type,ValueSet/us-core-procedure-code"
http://www.cms.gov/Medicare/Coding/ICD10,20201001,active,"2.16.840.1.113883.6.4",Icd10PCS,ICD-10 Procedure Codes,"ICD Procedure Coding System (ICD 10 PCS)","ValueSet/us-core-procedure-code"
https://nahdo.org/sopt,9.2,active,,SOP,Source of Payment Typology,"","ValueSet/ValueSet-birth-and-fetal-death-financial-class,ConceptMap/BirthAndFetalDeathFinancialClassCM"
urn:ietf:bcp:47,2.0.1,active,"2.16.840.1.113883.6.121",Ietf3066,Tags for the Identification of Languages,"Older value from OID registry.  Superceded; see recommendations in BCP-47.","ValueSet/languages,ValueSet/simple-language"
