URL,Version,Status,OIDs,Name,Title,Descriptino,Used
http://hl7.org/fhir/address-type,4.0.1,active,"2.16.840.1.113883.4.642.4.70",AddressType,AddressType,"The type of an address (physical / postal).","ValueSet/address-type"
http://hl7.org/fhir/address-use,4.0.1,active,"2.16.840.1.113883.4.642.4.68",AddressUse,AddressUse,"The use of an address.","ValueSet/address-use"
http://hl7.org/fhir/administrative-gender,4.0.1,active,"2.16.840.1.113883.4.642.4.2",AdministrativeGender,AdministrativeGender,"The gender of a person used for administrative purposes.","ValueSet/administrative-gender"
http://hl7.org/fhir/bundle-type,4.0.1,active,"2.16.840.1.113883.4.642.4.621",BundleType,BundleType,"Indicates the purpose of a bundle - how it is intended to be used.","ValueSet/bundle-type"
http://hl7.org/fhir/composition-attestation-mode,4.0.1,draft,"2.16.840.1.113883.4.642.4.239",CompositionAttestationMode,CompositionAttestationMode,"The way in which a person authenticated a composition.","ValueSet/composition-attestation-mode"
http://hl7.org/fhir/composition-status,4.0.1,draft,"2.16.840.1.113883.4.642.4.242",CompositionStatus,CompositionStatus,"The workflow/clinical status of the composition.","ValueSet/composition-status"
http://hl7.org/fhir/contact-point-system,4.0.1,active,"2.16.840.1.113883.4.642.4.72",ContactPointSystem,ContactPointSystem,"Telecommunications form for contact point.","ValueSet/contact-point-system"
http://hl7.org/fhir/contact-point-use,4.0.1,active,"2.16.840.1.113883.4.642.4.74",ContactPointUse,ContactPointUse,"Use of contact point.","ValueSet/contact-point-use"
http://hl7.org/fhir/days-of-week,4.0.1,active,"2.16.840.1.113883.4.642.4.513",DaysOfWeek,DaysOfWeek,"The days of the week.","ValueSet/days-of-week"
http://hl7.org/fhir/document-relationship-type,4.0.1,draft,"2.16.840.1.113883.4.642.4.245",DocumentRelationshipType,DocumentRelationshipType,"The type of relationship between documents.","ValueSet/document-relationship-type"
http://hl7.org/fhir/encounter-location-status,4.0.1,draft,"2.16.840.1.113883.4.642.4.263",EncounterLocationStatus,EncounterLocationStatus,"The status of the location.","ValueSet/encounter-location-status"
http://hl7.org/fhir/encounter-status,4.0.1,draft,"2.16.840.1.113883.4.642.4.247",EncounterStatus,EncounterStatus,"Current state of the encounter.","ValueSet/encounter-status"
http://hl7.org/fhir/event-status,4.0.1,draft,"2.16.840.1.113883.4.642.4.110",EventStatus,EventStatus,"Codes identifying the lifecycle stage of an event.","ValueSet/event-status"
http://hl7.org/fhir/fhir-types,5.0.0,active,"2.16.840.1.113883.4.642.4.1802",FHIRTypes,All FHIR Types,"One of the types defined as part of this version of FHIR.","ValueSet/resource-types"
http://hl7.org/fhir/fm-status,4.0.1,draft,"2.16.840.1.113883.4.642.4.593",FinancialResourceStatusCodes,Financial Resource Status Codes,"This value set includes Status codes.","ValueSet/fm-status"
http://hl7.org/fhir/http-verb,4.0.1,active,"2.16.840.1.113883.4.642.4.625",HTTPVerb,HTTPVerb,"HTTP verbs (in the HTTP command line). See [HTTP rfc](https://tools.ietf.org/html/rfc7231) for details.","ValueSet/http-verb"
http://hl7.org/fhir/identifier-use,4.0.1,active,"2.16.840.1.113883.4.642.4.58",IdentifierUse,IdentifierUse,"Identifies the purpose for this identifier, if known .","ValueSet/identifier-use"
http://hl7.org/fhir/link-type,4.0.1,active,"2.16.840.1.113883.4.642.4.424",LinkType,LinkType,"The type of link between this patient resource and another patient resource.","ValueSet/link-type"
http://hl7.org/fhir/list-mode,4.0.1,draft,"2.16.840.1.113883.4.642.4.319",ListMode,ListMode,"The processing mode that applies to this list.","ValueSet/list-mode"
http://hl7.org/fhir/location-mode,4.0.1,draft,"2.16.840.1.113883.4.642.4.331",LocationMode,LocationMode,"Indicates whether a resource instance represents a specific location or a class of locations.","ValueSet/location-mode"
http://hl7.org/fhir/location-status,4.0.1,draft,"2.16.840.1.113883.4.642.4.333",LocationStatus,LocationStatus,"Indicates whether the location is still in use.","ValueSet/location-status"
http://hl7.org/fhir/name-use,4.0.1,active,"2.16.840.1.113883.4.642.4.66",NameUse,NameUse,"The use of a human name.","ValueSet/name-use"
http://hl7.org/fhir/observation-status,4.0.1,active,"2.16.840.1.113883.4.642.4.401",ObservationStatus,ObservationStatus,"Codes providing the status of an observation.","ValueSet/observation-status"
http://hl7.org/fhir/quantity-comparator,4.0.1,active,"2.16.840.1.113883.4.642.4.60",QuantityComparator,QuantityComparator,"How the Quantity should be understood and represented.","ValueSet/quantity-comparator"
http://hl7.org/fhir/search-entry-mode,4.0.1,active,"2.16.840.1.113883.4.642.4.623",SearchEntryMode,SearchEntryMode,"Why an entry is in the result set - whether it's included as a match or because of an _include requirement, or to convey information or warning information about the search process.","ValueSet/search-entry-mode"
http://hl7.org/fhir/sid/icd-10,2.1.1,retired,"2.16.840.1.113883.6.3",Icd10,ICD-10,"International Classification of Diseases revision 10 (ICD 10)","ValueSet/2.16.840.1.114222.4.11.7933"
http://hl7.org/fhir/sid/icd-10-cm,2.0.1,active,"2.16.840.1.113883.6.90",Icd10CM,International Classification of Diseases, 10th Revision, Clinical Modification (ICD-10-CM),"The International Classification of Diseases, 10th Revision, Clinical Modification (ICD-10-CM), describes the classification of morbidity and mortality information for statistical purposes and for the indexing of healthcare records by diseases. The ICD-10-CM codes can be used as the value of the Act.cd attribute.","ValueSet/us-core-condition-code"
http://hl7.org/fhir/us/bfdr/CodeSystem/CodeSystem-edit-flags,2.0.0-Ballot,draft,,EditFlagsCS,Birth Edit Flags,"This code system contains codes to represent edit flags specific to BFDR. Additional edit flag codes are located in [CodeSystemEditFlagsVitalRecords]","ValueSet/ValueSet-estimate-of-gestation-edit-flags,ConceptMap/BirthWeightEditFlagsCM,ConceptMap/NumberPreviousCesareansEditFlagsCM,ValueSet/ValueSet-birth-weight-edit-flags,ValueSet/ValueSet-number-previous-cesareans-edit-flags,ConceptMap/EstimateOfGestationEditFlagsCM"
http://hl7.org/fhir/us/bfdr/CodeSystem/CodeSystem-local-bfdr-codes,2.0.0-Ballot,draft,,LocalBFDRCodesCS,Local BFDR Codes,"Local Codes for concepts in BFDR that lack an appropriate LOINC or SCT code","ValueSet/ValueSet-fetal-death-cause-or-condition,ValueSet/ValueSet-informant-relationship-to-mother,ConceptMap/FetalDeathCauseOrConditionCM,ConceptMap/BirthDeliveryOccurredCM,ValueSet/ValueSet-location-types,ValueSet/ValueSet-birth-delivery-occurred"
http://hl7.org/fhir/us/core/CodeSystem/condition-category,5.0.1,active,,USCoreConditionCategoryExtensionCodes,US Core Condition Category Extension Codes,"Set of codes that are needed for implementation of the US-Core Condition Profile. These codes are used as extensions to the FHIR and US Core value sets.","ValueSet/us-core-problem-or-health-concern"
http://hl7.org/fhir/us/vr-common-library/CodeSystem/CodeSystem-canadian-provinces-vr,2.0.0,active,,CodeSystemCanadianProvincesVitalRecords,Canadian Provinces Vital Records,"Canadian Provinces","ValueSet/ValueSet-states-territories-provinces-vr"
http://hl7.org/fhir/us/vr-common-library/CodeSystem/CodeSystem-country-code-vr,2.0.0,active,,CodeSystemCountryCodeVitalRecords,Country Codes Vital Records,"2 Letter Country Codes from GEC and ISO 3166-1","ValueSet/ValueSet-residence-country-vr,ValueSet/ValueSet-birthplace-country-vr"
http://hl7.org/fhir/us/vr-common-library/CodeSystem/CodeSystem-us-states-territories-vr,2.0.0,active,,CodeSystemUSStatesTerritoriesVitalRecords,US States and Territories,"Surrogate for usps.com codesystem.  IG Publisher is not happy with that codesystem.","ValueSet/ValueSet-states-territories-provinces-vr,ValueSet/ValueSet-usstates-vr,ValueSet/ValueSet-usterritories-vr"
http://hl7.org/fhir/us/vr-common-library/CodeSystem/CodeSystem-vr-edit-flags,2.0.0,active,,CodeSystemEditFlagsVitalRecords,Birth and Death Edit Flags Vital Records,"This code system contains codes to represent all edit flags","ValueSet/ValueSet-date-of-birth-edit-flags-vr,ValueSet/ValueSet-estimate-of-gestation-edit-flags,ConceptMap/BirthWeightEditFlagsCM,ValueSet/ValueSet-plurality-edit-flags-vr,ConceptMap/PregnancyReportEditFlagsCM,ConceptMap/NumberPreviousCesareansEditFlagsCM,ValueSet/ValueSet-birth-weight-edit-flags,ValueSet/ValueSet-number-previous-cesareans-edit-flags,ConceptMap/EstimateOfGestationEditFlagsCM,ValueSet/ValueSet-pregnancy-report-edit-flags"
http://hl7.org/fhir/us/vr-common-library/CodeSystem/codesystem-ije-vr,2.0.0,active,,CodeSystemIJEVitalRecords,Placeholder Code System for IJE in Vital Records,"IJE Code System Placeholder is needed to provide a URL upon which to anchor concept maps.","ConceptMap/InfectionsDuringPregnancyLiveBirthCM,ConceptMap/BirthAttendantTitlesCM,ConceptMap/BirthWeightEditFlagsCM,ConceptMap/DeliveryRoutesCM,ConceptMap/FetalPresentationCM,ConceptMap/NewbornCongenitalAnomaliesCM,ConceptMap/NumberPreviousCesareansEditFlagsCM,ConceptMap/BirthAndFetalDeathFinancialClassCM,ConceptMap/FetalDeathTimePointsCM,ConceptMap/FetalDeathCauseOrConditionCM,ConceptMap/BirthDeliveryOccurredCM,ConceptMap/HistologicalPlacentalExaminationCM,ConceptMap/PregnancyReportEditFlagsCM,ConceptMap/EstimateOfGestationEditFlagsCM"
http://loinc.org,3.1.0,active,"2.16.840.1.113883.6.1",LOINC,Logical Observation Identifiers, Names and Codes (LOINC),"LOINC provides a set of universal names and ID codes for identifying laboratory and clinical test results.1,2 LOINC facilitates the exchange and pooling of results, such as blood hemoglobin, serum potassium, or vital signs, for clinical care, outcomes management, and research. LOINC's universal identifiers (names and codes) can be used in the context of order and observation exchanges between information systems that use syntax standards such as HL73, CEN TC251, ISO TC215, ASTM4, and DICOM. Specifically, the identifier can be used as the coded value for an observation in any other standard that uses the observation/observation value paradigm, whether messages, documents, application programming interface (API), etc. For example, LOINC codes are used widely in the OBX segment Observation Identifier field (OBX-3) of an ORU HL7 (HL7 version 2.x or ASTM 1238-9410) message that may be sent between a Clinical Laboratory Information Management Systems (LIMS) and Electronic Health Record Systems (EHR).5, 6 In this way, LOINC codes provide universal identifiers that allow the exchange of clinical data between heterogeneous computing environments.","ValueSet/us-core-vital-signs,ValueSet/ValueSet-apgar-timing,ValueSet/us-core-procedure-code,ValueSet/observation-codes,ValueSet/cigarette-smoking-before-during-pregnancy,ValueSet/document-classcodes,ValueSet/doc-section-codes,ValueSet/doc-typecodes"
http://snomed.info/sct,null,active,"2.16.840.1.113883.6.96",SNOMED_CT,SNOMED CT (all versions),"SNOMED CT is the most comprehensive and precise clinical health terminology product in the world, owned and distributed around the world by The International Health Terminology Standards Development Organisation (IHTSDO).","ConceptMap/BirthAttendantTitlesCM,ValueSet/condition-stage,ValueSet/us-core-encounter-type,ValueSet/encounter-reason,ConceptMap/DeliveryRoutesCM,ValueSet/ValueSet-fetal-presentations,ConceptMap/NewbornCongenitalAnomaliesCM,ValueSet/ValueSet-birth-attendant-titles,ValueSet/ValueSet-infections-during-pregnancy-live-birth,ValueSet/ValueSet-fetal-presentations-max,ValueSet/ValueSet-birth-delivery-occurred,ValueSet/procedure-followup,ValueSet/device-action,ConceptMap/HistologicalPlacentalExaminationCM,ValueSet/us-core-condition-code,ValueSet/ValueSet-delivery-routes,ValueSet/body-site,ValueSet/ValueSet-newborn-congenital-anomalies,ValueSet/manifestation-or-symptom,ValueSet/device-kind,ConceptMap/InfectionsDuringPregnancyLiveBirthCM,ValueSet/ValueSet-obstetric-procedure-outcome,ValueSet/performer-role,ValueSet/ValueSet-histological-placental-examination,ValueSet/ValueSet-birth-attendant-titles-vr,ValueSet/referencerange-appliesto,ConceptMap/FetalPresentationCM,ValueSet/procedure-reason,ValueSet/procedure-outcome,ValueSet/procedure-category,ConceptMap/FetalDeathTimePointsCM,ValueSet/condition-code,ValueSet/ValueSet-fetal-remains-disposition-method,ValueSet/ValueSet-fetal-death-cause-or-condition,ConceptMap/FetalDeathCauseOrConditionCM,ConceptMap/BirthDeliveryOccurredCM,ValueSet/condition-stage-type,ValueSet/ValueSet-apgar-timing,ValueSet/procedure-not-performed-reason,ValueSet/observation-methods,ValueSet/us-core-procedure-code,ValueSet/ValueSet-fetal-death-time-points,ValueSet/condition-severity"
http://terminology.hl7.org/CodeSystem/admit-source,0.1.0,draft,"2.16.840.1.113883.4.642.1.1092",AdmitSource,Admit source,"This value set defines a set of codes that can be used to indicate from where the patient came in.","ValueSet/encounter-admit-source"
http://terminology.hl7.org/CodeSystem/condition-category,0.5.0,draft,"2.16.840.1.113883.4.642.1.1073",ConditionCategoryCodes,Condition Category Codes,"Preferred value set for Condition Categories.","ValueSet/condition-category,ValueSet/us-core-problem-or-health-concern"
http://terminology.hl7.org/CodeSystem/condition-clinical,2.0.0,active,"2.16.840.1.113883.4.642.1.1074",ConditionClinicalStatusCodes,Condition Clinical Status Codes,"Preferred value set for Condition Clinical Status.","ValueSet/condition-clinical"
http://terminology.hl7.org/CodeSystem/condition-ver-status,1.0.0,draft,"2.16.840.1.113883.4.642.1.1075",ConditionVerificationStatus,ConditionVerificationStatus,"The verification status to support or decline the clinical status of the condition or diagnosis.","ValueSet/condition-ver-status"
http://terminology.hl7.org/CodeSystem/coverage-class,0.1.0,draft,"2.16.840.1.113883.4.642.1.1147",CoverageClassCodes,Coverage Class Codes,"This value set includes Coverage Class codes.","ValueSet/coverage-class"
http://terminology.hl7.org/CodeSystem/coverage-copay-type,0.1.0,draft,"2.16.840.1.113883.4.642.1.1149",CoverageCopayTypeCodes,Coverage Copay Type Codes,"This value set includes sample Coverage Copayment Type codes.","ValueSet/coverage-copay-type"
http://terminology.hl7.org/CodeSystem/data-absent-reason,0.1.0,active,"2.16.840.1.113883.4.642.4.1048",DataAbsentReason,DataAbsentReason,"Used to specify why the normally expected content of the data element is missing.","ValueSet/data-absent-reason"
http://terminology.hl7.org/CodeSystem/diagnosis-role,0.1.1,draft,"2.16.840.1.113883.4.642.1.1054",DiagnosisRole,Diagnosis Role,"This value set defines a set of codes that can be used to express the role of a diagnosis on the Encounter or EpisodeOfCare record.","ValueSet/diagnosis-role"
http://terminology.hl7.org/CodeSystem/diet,0.1.0,draft,"2.16.840.1.113883.4.642.1.1091",Diet,Diet,"This value set defines a set of codes that can be used to indicate dietary preferences or restrictions a patient may have.","ValueSet/encounter-diet"
http://terminology.hl7.org/CodeSystem/encounter-special-arrangements,0.1.0,draft,"2.16.840.1.113883.4.642.1.1090",SpecialArrangements,Special arrangements,"This value set defines a set of codes that can be used to indicate the kinds of special arrangements in place for a patients visit.","ValueSet/encounter-special-arrangements"
http://terminology.hl7.org/CodeSystem/ex-coverage-financial-exception,0.1.0,draft,"2.16.840.1.113883.4.642.1.1329",ExampleCoverageFinancialExceptionCodes,Example Coverage Financial Exception Codes,"This value set includes Example Coverage Financial Exception Codes.","ValueSet/coverage-financial-exception"
http://terminology.hl7.org/CodeSystem/list-empty-reason,0.1.0,draft,"2.16.840.1.113883.4.642.1.1106",ListEmptyReasons,List Empty Reasons,"General reasons for a list to be empty. Reasons are either related to a summary list (i.e. problem or medication list) or to a workflow related list (i.e. consultation list).","ValueSet/list-empty-reason"
http://terminology.hl7.org/CodeSystem/list-order,0.1.0,draft,"2.16.840.1.113883.4.642.1.1107",ListOrderCodes,List Order Codes,"Base values for the order of the items in a list resource.","ValueSet/list-order"
http://terminology.hl7.org/CodeSystem/location-physical-type,1.0.0,draft,"2.16.840.1.113883.4.642.1.1108",LocationType,Location type,"This example value set defines a set of codes that can be used to indicate the physical form of the Location.  This includes several 'non physical' codes which are still considered a location.","ValueSet/location-physical-type"
http://terminology.hl7.org/CodeSystem/observation-category,0.1.0,draft,"2.16.840.1.113883.4.642.1.1125",ObservationCategoryCodes,Observation Category Codes,"Observation Category codes.","ValueSet/observation-category"
http://terminology.hl7.org/CodeSystem/participant-type,0.5.0,draft,"2.16.840.1.113883.4.642.1.1089",ParticipantType,Participant type,"This value set defines a set of codes that can be used to indicate how an individual participates in an encounter.","ValueSet/encounter-participant-type"
http://terminology.hl7.org/CodeSystem/referencerange-meaning,0.1.0,draft,"2.16.840.1.113883.4.642.1.1124",ObservationReferenceRangeMeaningCodes,Observation Reference Range Meaning Codes,"This value set defines a set of codes that can be used to indicate the meaning/use of a reference range for a particular target population.","ValueSet/referencerange-meaning"
http://terminology.hl7.org/CodeSystem/service-type,0.1.0,draft,"2.16.840.1.113883.4.642.1.1145",ServiceType,Service type,"This value set defines an example set of codes of service-types.","ValueSet/service-type"
http://terminology.hl7.org/CodeSystem/subscriber-relationship,0.1.0,draft,"2.16.840.1.113883.4.642.1.1386",SubscriberRelationshipCodes,SubscriberPolicyholder Relationship Codes,"This value set includes codes for the relationship between the Subscriber and the Beneficiary (insured/covered party/patient).","ValueSet/subscriber-relationship"
http://terminology.hl7.org/CodeSystem/v2-0092,2.1.0,active,"2.16.840.1.113883.18.36",ReAdmissionIndicator,re-admissionIndicator,"Code system of concepts which are used to specify that a patient is being re admitted to a healthcare facilityin from which they were discharged, and indicates the circumstances around such re-admission.  Used in HL7 Version 2.x messagine in the PV1 segment.","ValueSet/v2-0092"
http://terminology.hl7.org/CodeSystem/v2-0116,2.2.0,active,"2.16.840.1.113883.18.47",BedStatus,bedStatus,"Code system of concepts which specify the state of a bed in an inpatient setting, and is used to determine if a patient may be assigned to it or not.  Used in HL7 Version 2.x messaging in the DLD and PV1 segments.","ValueSet/v2-0116"
http://terminology.hl7.org/CodeSystem/v2-0131,2.1.0,active,"2.16.840.1.113883.18.58",ContactRole2,contactRole2,"Code system of concepts which specify a relationship role that the next of kin/associated parties plays with regard to the patient. Also used in referrals, for example, it may be necessary to identify the contact representative at the clinic that sent a referral. Used in HL7 Version 2 messaging in the NK1 and CTD segments after 2.5, when it replace 2.16.840.1.113883.18.57.","ValueSet/patient-contactrelationship"
http://terminology.hl7.org/CodeSystem/v2-0136,2.9,active,"2.16.840.1.113883.18.347",v2.0136,v2 Y/N Indicator,"FHIR Value set/code system definition for HL7 v2 table 0136 ( Y/N Indicator)","ValueSet/ValueSet-yes-no-not-applicable-vr,ValueSet/ValueSet-yes-no-unknown-vr"
http://terminology.hl7.org/CodeSystem/v2-0203,3.0.0,active,"2.16.840.1.113883.18.108",IdentifierType,identifierType,"HL7-defined code system of concepts specifying type of identifier. Used in HL7 Version 2.x messaging data types CX, PLN, PPN, XCN and XON.","ValueSet/identifier-type"
http://terminology.hl7.org/CodeSystem/v2-0360,2.1.0,active,"2.16.840.1.113883.18.220",DegreeLicenseCertificate,degreeLicenseCertificate,"Code system of concepts specifying an educational degree (e.g., MD).  Used in the CNN datatype (names and identifiers of clinicians) in Version 2 messaging.  Used in HL7 Version 2.x messaging in the CNN segment; note that in releases of HL7 prior to 2.3.1, was also used in person names (XPN), but this use was deprecated, then withdrawn in 2.7.","ValueSet/ValueSet-education-level-vr"
http://terminology.hl7.org/CodeSystem/v3-ActCode,8.0.1,active,"2.16.840.1.113883.5.4",ActCode,ActCode,"A code specifying the particular kind of Act that the Act-instance represents within its class.    *Constraints:* The kind of Act (e.g. physical examination, serum potassium, inpatient encounter, charge financial transaction, etc.) is specified with a code from one of several, typically external, coding systems. The coding system will depend on the class of Act, such as LOINC for observations, etc.    Conceptually, the Act.code must be a specialization of the Act.classCode. This is why the structure of ActClass domain should be reflected in the superstructure of the ActCode domain and then individual codes or externally referenced vocabularies subordinated under these domains that reflect the ActClass structure.    Act.classCode and Act.code are not modifiers of each other but the Act.code concept should really imply the Act.classCode concept. For a negative example, it is not appropriate to use an Act.code ""potassium"" together with and Act.classCode for ""laboratory observation"" to somehow mean ""potassium laboratory observation"" and then use the same Act.code for ""potassium"" together with Act.classCode for ""medication"" to mean ""substitution of potassium"". This mutually modifying use of Act.code and Act.classCode is not permitted.","ValueSet/v3-ActCode,ValueSet/v3-ActEncounterCode"
http://terminology.hl7.org/CodeSystem/v3-ActPriority,2.1.0,active,"2.16.840.1.113883.5.7",ActPriority,ActPriority,"A set of codes (e.g., for routine, emergency), specifying the urgency under which the Act happened, can happen, is happening, is intended to happen, or is requested/demanded to happen.","ValueSet/v3-ActPriority"
http://terminology.hl7.org/CodeSystem/v3-AdministrativeGender,2.1.0,active,"2.16.840.1.113883.5.1",AdministrativeGender,AdministrativeGender,"The gender of a person used for adminstrative purposes (as opposed to clinical gender)","ValueSet/ValueSet-sex-assigned-at-birth-vr"
http://terminology.hl7.org/CodeSystem/v3-Confidentiality,2.2.0,active,"2.16.840.1.113883.5.25",Confidentiality,Confidentiality,"A set of codes specifying the security classification of acts and roles in accordance with the definition for concept domain ""Confidentiality"".","ValueSet/v3-ConfidentialityClassification"
http://terminology.hl7.org/CodeSystem/v3-EducationLevel,2.1.0,active,"2.16.840.1.113883.5.1077",EducationLevel,Education Level,"Years of education that a person has completed","ValueSet/ValueSet-education-level-vr"
http://terminology.hl7.org/CodeSystem/v3-EncounterSpecialCourtesy,2.1.0,active,"2.16.840.1.113883.5.40",EncounterSpecialCourtesy,EncounterSpecialCourtesy,"**** MISSING DESCRIPTION ****","ValueSet/encounter-special-courtesy"
http://terminology.hl7.org/CodeSystem/v3-MaritalStatus,2.1.0,active,"2.16.840.1.113883.5.2",MaritalStatus,MaritalStatus,"\* \* \* No description supplied \* \* \*    *Open Issue:* The specific meanings of these codes can vary somewhat by jurisdiction and implementation so caution should be used when determining equivalency.    *Open Issue:* fixing and completion of the hierarchy and proper good definitions of all the concepts is badly needed.","ValueSet/marital-status"
http://terminology.hl7.org/CodeSystem/v3-NullFlavor,2.1.0,active,"2.16.840.1.113883.5.1008",NullFlavor,NullFlavor,"A collection of codes specifying why a valid value is not present.","ConceptMap/BirthAttendantTitlesCM,ValueSet/ValueSet-birth-attendant-titles-vr,ValueSet/ValueSet-yes-no-unknown-vr,ValueSet/ValueSet-education-level-vr,ConceptMap/FetalPresentationCM,ValueSet/ValueSet-fetal-presentations,ValueSet/ValueSet-birth-attendant-titles,ValueSet/ValueSet-infections-during-pregnancy-live-birth,ValueSet/ValueSet-birth-delivery-occurred,ConceptMap/FetalDeathTimePointsCM,ValueSet/ValueSet-sex-assigned-at-birth-vr,ValueSet/ValueSet-fetal-remains-disposition-method,ValueSet/ValueSet-fetal-death-cause-or-condition,ConceptMap/FetalDeathCauseOrConditionCM,ValueSet/ValueSet-states-territories-provinces-vr,ValueSet/ValueSet-yes-no-not-applicable-vr,ConceptMap/BirthDeliveryOccurredCM,ValueSet/ValueSet-newborn-congenital-anomalies,ValueSet/marital-status,ValueSet/ValueSet-fetal-death-time-points,ValueSet/encounter-special-courtesy"
http://terminology.hl7.org/CodeSystem/v3-ObservationInterpretation,2.1.0,active,"2.16.840.1.113883.5.83",ObservationInterpretation,ObservationInterpretation,"One or more codes providing a rough qualitative interpretation of the observation, such as ""normal"" / ""abnormal"", ""low"" / ""high"", ""better"" / ""worse"", ""resistant"" / ""susceptible"", ""expected"" / ""not expected"". The value set is intended to be for ANY use where coded representation of an interpretation is needed.","ValueSet/observation-interpretation"
http://terminology.hl7.org/CodeSystem/v3-ParticipationType,4.0.0,active,"2.16.840.1.113883.5.90",ParticipationType,ParticipationType,"A code specifying the meaning and purpose of every Participation instance. Each of its values implies specific constraints on the Roles undertaking the participation.","ValueSet/encounter-participant-type"
http://terminology.hl7.org/CodeSystem/v3-RoleCode,2.2.0,active,"2.16.840.1.113883.5.111",RoleCode,RoleCode,"A set of codes further specifying the kind of Role; specific classification codes for further qualifying RoleClass codes.","ValueSet/ValueSet-role-vr,ValueSet/v3-ServiceDeliveryLocationRoleType"
